No,Ulasan,Label,Pelayanan,Fasilitas,Wahana,Kuliner
570,mantul enak panda sejuk latar sawah hampar hijau uning nya padi panen rapi gunung exotis sekal enak leseh luarga tiket masuk murah riah weeknd penuh parkir pokona mah top martkop sumber gempong euy,0,0,1,0,0
571,pilih wisata lepas lelah jenuh aktivitas hidup kota nyaman,1,0,1,0,0
572,marin habis jalan surabaya jam motor nyasar nyata wisata masuk gang pas sampa tuju senang banget suguh indah alam sawah hijau background gunung minus panas jarang teduh recommend pas kantin buka senen buka makan harga murah start ribu wahana jangkau ribu suka wahana reta itar sawah seru sekal air sejuk asli sumber gunung mskipun panas bikin belang kulit marin pengin kuda orang jaga loket weekend its oke sih hehe oiya tiket masuk murah banget ribu orang parkir motor ribu jalan tidak anjak curam bawa motor worth,0,0,1,1,1
573,wisata murah riah harga tiket masuk nya murah orang makan murah pangsit mie ayam paka tepak makan plastik wahana murah pandang nya bikin refresh gubuk paka ngdingin main air sawah,1,0,1,1,1
574,mantap banget,1,0,1,0,0
575,asik apalag wahana reta liling sawah,1,0,0,1,0
576,nyaman asri enak banget healing introvert ramah banget,1,0,1,0,0
577,kunjung minggu panas macet,0,0,1,0,0
578,harga tiket masuk orang masuk lokasi parkir main beli wahana ticketing harga tiket favorit reta sawah tiket antri kode tiket panggil eras suara hindar hujan jalan basah area parkir tanah padat recommended serame batu layan ramah masuk sampa parkir,0,1,1,1,0
579,oke siang dikit panas ya,0,0,1,0,0
580,biaya masuk murah riah khas desa banget suasana,1,0,1,0,0
581,pandang alam sok refresing segar tingkat arah masuk lokasi,1,0,1,0,0
582,wisata bagus pandang indah sekedar masu jalan masuk ndara pisah jalan sempit ganti masuk area wisata,0,0,1,0,0
583,wisata alam hampar sawah hijau luas segar mata udara sejuk tiket masuk murah rp wahana main reta sawah flying fox tiket pisah ya makan murah riah enak wisata utama sebenar sumber mata air alam suka santa gubuk sawah ikmat angin sepo sepo pagi pas weekend siang dikit rama parkir luas cocok libur luarga tipis tipis,1,0,1,1,1
584,murah riah wisata,1,0,1,0,0
585,tiket wahana golong mahal,0,0,0,1,0
586,weekend rama unjung,0,0,1,0,0
587,wisata alam murah alam,1,0,1,0,0
588,senang wisata harga tiket masuk murah bikin bahagia,1,0,1,0,0
589,bagus sejuk jam siang,1,0,1,0,0
590,sejuk sekal,1,0,1,0,0
591,wisata murah riah harga tiket masuk jangkau wahana anak anak dewasa lengkqpi sarana sepert kuliner toilet gazebo mushola weekend libur ubtuk teduh panas hujan cari jalan beda lokasi wisata tidak macet ganti ndaar masuk perlebar akses jalan uju lokasi wisata,0,1,1,0,0
592,wisata desa asri cuman antri wahana sampa sih anak rewel nunggu,0,0,1,1,0
593,bagus refreshing embang utama layan unjung sepert toilet ruang tunggu wahana perba unjung ima kasih,0,0,1,0,0
594,cocok buatvhealing suasana desa makan jangkau,1,0,1,0,1
595,bagus kids ramah sayang reservasi aula ayun jatra tidak tanda unjung duduk booking tugas,0,1,1,0,0
596,bagus main teduh musholla kamar mandi bersih cocok cinta alam,1,0,1,1,0
597,rekomendasi deh,1,0,1,0,0
598,pandang alam fresh,1,0,1,0,0
599,hawa nya bikin betah,1,0,1,0,0
600,cocok weekend bareng luarga tiket masuk murah banget wahana bayar renang gratis tenant makan parkir luas,1,0,1,1,1
601,pandang sawah gunung cocok wisata luarga toilet bersih parkir luas harga tiket masuk ribu wahana info foto ya therap ikan gratis minus akses masuk macet an jalan tanja harap hati bawa luarga anak motor,0,0,1,1,0
602,murah riah ingkat ekonomi warga cuman teduh lokasi makan minum,0,1,1,0,1
603,lokasi sete villa vanda gardenia gang masuk kiri arah vanda lumay luas pandang bagus letak lereng anggung welirang pandang gunung anggung latar sawah daya tarik sendir sesedia gubuk saung sawah teduh istirahat makan bekal wahana atv reta kolam renang sayang kolam renang kotor pujasera pintu masuk jual makan ringan goreng kolam renang parkir mobil motor luas banget gang masuk lokasi mepet salip mobil tugas tiket masuk orang wahana bayar,0,1,1,1,1
604,keren tempatnyaaa cocok otbon anak,1,0,1,0,0
605,hawa sejuk sejuk cocok nyanta luarga tiket masuk murah ambah nikmat jalan jalan bikin kantong jebol,1,0,1,0,0
606,tiket masuk rp karcis mobil rp sepedah langit rp becak langit rp becak air rp suasana sawah segar nyaman banget,1,0,1,1,0
607,weekday tiket masuk parkir mobil ribu tiket main lumay jangkau suasana sawah sejuk,1,0,1,1,0
608,rama banget utama pas weekend antrinuntuk reta sawah,0,0,1,1,0
609,enak nyaman,1,0,1,0,0
610,bagus pandang,1,0,1,0,0
611,panas kayak sawah,0,0,1,0,0
612,panass bawa payung rumah,0,0,1,0,0
613,wajib bawa tiker ya pandang bagus sawah dingin pilih makan mending bawa bekal sendir suasana cocok luarga,0,0,1,0,1
614,nyaman asri alam uenak poll,1,0,1,0,0
615,suasana desa asri hijau nan subur kolam renang warung makan saung sawah harga tiket masuk nya ribu rupiah wajib bawa topi arau payung panas teduh,0,0,1,1,1
616,teduh wisataw nya panas,0,0,1,0,0
617,libur rama pol ikmat tiket masuk murah akses jalan masuk wisata sempit rusak mudah elo akses jalan masuk wisata,0,1,1,0,0
618,nya lumay bagus sayang tunjang jalan rusak sempit mobil papas sempit sekal,0,0,1,0,0
619,tiket murah akses jalan rusak,0,0,1,0,0
620,pandang objek wisata wilayah trawas sebal attitude jaga parkir tidak sopan belagu bayar karcis masuk tidak karcis attitude tidak ramah parah wisata gantung sda gantung sdm sdm buruk orang mbali recommended urut mending ajak luarga main taman ghanjar kampung brenjonk,0,1,1,0,0
621,elola tidak sopan,0,1,1,0,0
622,panas akses jalan rusak,0,0,1,0,0
623,sejuk indah wahana kantin jual lihat kotor arik,0,0,1,1,1
624,fasilitas konsep nya kotor jalan sempit bawa mobil sabar menga simpang sempit ekstra hati parkir mobil semoga tingkat fasilitas nya,0,0,1,0,0
625,weekend macet,0,0,1,0,0
626,kunjung minggu panas macet,0,0,1,0,0
627,libur rama pol ikmat tiket masuk murah akses jalan masuk wisata sempit rusak mudah elo akses jalan masuk wisata,0,0,1,0,0
628,pandang bagus letak sawah sedia kolam renang mata air sumber cuaca panas sekal,0,0,1,1,0
629,parkir becek buruk,0,0,1,0,0
630,akses jalan jelek sempit mobil,0,0,1,0,0
631,lumay bagus panas gubug nya,0,0,1,0,0
632,panas,0,0,1,0,0
633,wisata bagus jual ramah kamar mandi tidak kunci bersih,0,1,1,0,0
634,bagus murah sayang akses jalan sempit batu,0,0,1,0,0
635,teduh panas,0,0,1,0,0
636,mobil kondisi nya tanja curam,0,0,1,0,0
637,becek,0,0,1,0,0
638,exit buruk,0,0,1,0,0
639,indah panas,0,0,1,0,0
640,puas fasilitas layan tm mahal parkir mobil area bebas parkir,0,1,1,0,0
641,admin tidak ramah,0,1,0,0,0
642,puol gadibolehin belok ogah yaudah gajad,0,1,0,0,0
643,bagus sayang elola kesan tidak sopan,0,1,1,0,0
644,parkir jelek sempit buruk,0,0,1,0,0
645,kolam renang anak kotor,0,0,0,1,0
646,bagus banget cuman sayang jaga tiket tukang parkir ramah telit,0,1,1,0,0
647,nya bagus sayang musholla,0,0,1,0,0
648,parkir mobil,0,0,1,0,0
649,parkir bagus becek,0,0,1,0,0
650,hi kak bagus banget bersih toilet tolong tingkat ya,0,0,1,0,0
651,antri banget minggu marin deh,0,0,0,1,0
652,masuk situ gagal masuk penuh tidak parkir jam siang,0,0,1,0,0
653,bus tidak masuk,0,0,1,0,0
654,kamar mandi air kotor tidak anjur mandi toilet,0,0,1,0,0
655,tidak recommended air kolam renang gatal air kali kotor,0,0,0,1,0
656,jaan masuk sempit,0,0,1,0,0
657,rama antri,0,0,1,0,0
658,parkir sulit,0,0,1,0,0
659,parkir mobil,0,0,1,0,0
660,oke butuh teduh,0,0,1,0,0
661,bagus seada parkir becek,0,0,1,0,0
662,nya lumay pas cuaca mendung cuaca pas terik panas pool,0,0,1,0,0
663,bagus natural hibur rakyat all free parkir bayar hati jalan masuk sempit mobil mohon sabar pandu jalan,0,1,1,0,0
664,teduh,0,0,1,0,0
665,wisata alam rekomendasi nuansa alam buka sebagi wahana seru pandang alam cocok sekal background foto posting sosmed pandang gunung sawah kolam endam saran awasi damping anak enang kolam golong bahaya kolam bebatu alam lumut pungkin cidera tidak hati hati kolam air dingin panas pasuk area wisata jalan sempit mobil mpv suv ganti,0,1,1,1,0
666,wajib cebur kolam cuman parkir mobil kasih tenda biar hot lotot wkwkwk,0,0,1,0,0
667,siang panas,0,0,1,0,0
668,nya asyik murah mria djangkau kalang tnga kbawah lahan parkir sulit masuk pas rama nya main anak murah tiket wajar hrganya jaga parkir montor lbi ya mlayan mhn dbantu motor sulit pnataa numpuk bratur medan batu krikil sring orang trglincir roda motor drata drapi the best dach namba ngecamp mnghadap area sawah semoga lbi sukss mngelo area,0,1,1,1,0
669,panas rama kapasitas parkir tidak padah,0,0,1,0,0
670,jalan utama mobil,0,0,1,0,0
671,panas banget pandang nya bagus air segar toilet,0,0,1,0,0
672,tutup pagi paka banget,0,1,0,0,0
673,bagus alam sayang nya batu alas kolam renang tajam,0,0,1,1,0
674,bagus pandang sayang makan tidak variatif,0,0,1,0,1
